<!ELEMENT rutas (ruta+)>
<!ATTLIST rutas 
    xmlns CDATA #FIXED "http://www.uniovi.es"
    xmlns:xsi CDATA #IMPLIED
    xsi:schemaLocation CDATA #IMPLIED>

<!ELEMENT ruta (nombre, tipo, medioTransporte, fechaInicio?, horaInicio?, duracion, agencia, descripcion, personasAdecuadas, lugarInicio, direccionInicio, coordenadasInicio, referencias, recomendacion, hitos, planimetria, altimetria)>
<!ATTLIST ruta id ID #REQUIRED>

<!ELEMENT nombre (#PCDATA)>
<!ELEMENT tipo (#PCDATA)>
<!ELEMENT medioTransporte (#PCDATA)>
<!ELEMENT fechaInicio (#PCDATA)>
<!ELEMENT horaInicio (#PCDATA)>
<!ELEMENT duracion (#PCDATA)>
<!ELEMENT agencia (#PCDATA)>
<!ELEMENT descripcion (#PCDATA)>
<!ELEMENT personasAdecuadas (#PCDATA)>
<!ELEMENT lugarInicio (#PCDATA)>
<!ELEMENT direccionInicio (#PCDATA)>

<!ELEMENT coordenadasInicio (longitud, latitud, altitud)>
<!ELEMENT longitud (#PCDATA)>
<!ELEMENT latitud (#PCDATA)>
<!ELEMENT altitud (#PCDATA)>

<!ELEMENT referencias (referencia+)>
<!ELEMENT referencia (#PCDATA)>

<!ELEMENT recomendacion (#PCDATA)>

<!ELEMENT hitos (hito+)>
<!ELEMENT hito (nombre, descripcion, coordenadas, distancia, fotografias, videos?)>
<!ELEMENT coordenadas (longitud, latitud, altitud)>
<!ELEMENT distancia (#PCDATA)>
<!ATTLIST distancia unidades CDATA #REQUIRED>

<!ELEMENT fotografias (fotografia+)>
<!ELEMENT fotografia (#PCDATA)>

<!ELEMENT videos (video*)>
<!ELEMENT video (#PCDATA)>

<!ELEMENT planimetria (#PCDATA)>
<!ELEMENT altimetria (#PCDATA)>